repo,pr,strategy,review,commits,review_comments,time
kubernetes/kubernetes,138050,baseline,"[{'type': 'Readability', 'description': ""提交信息中的提交说明（commit message）存在拼写错误，将 'world' 拼写为 'wold'，这会影响提交历史的清晰度和可搜索性。"", 'evidence': ""提交信息: 'Rename desired_state_of_wold_selinux_metrics.go to desired_state_of_world_selinux_metrics.go'"", 'advice': ""建议修正提交信息中的拼写错误，将 'wold' 更正为 'world'，以确保提交信息的准确性。"", 'severity': 'Low'}, {'type': 'Readability', 'description': ""代码注释从模糊的 'FIXME' 替换为更清晰、准确的描述，提高了代码的可读性和可维护性。"", 'evidence': ""代码变更: '- // FIXME: Replace sets.Set[string] with sets.Set[string]\n+ // In tests, treat kubelet config sources as always ready.'"", 'advice': '这是一个积极的改进，无需进一步建议。', 'severity': 'Low'}]","[{'sha': 'dc99c66f203b6cbc2beb96b515dc9ede87ccb9c1', 'message': '    kubelet: fix volumemanager filename typo; clarify devicemanager test comment\n\n    - Rename desired_state_of_wold_selinux_metrics.go to desired_state_of_world_selinux_metrics.go\n    - Replace misleading FIXME in runPluginManager test with an accurate comment'}]","['<a href=""https://easycla.lfx.linuxfoundation.org/#/?version=2""><img src=""https://s3.amazonaws.com/cla-project-logo-prod/cla-signed.svg?v=2"" alt=""CLA Signed"" align=""left"" height=""28"" width=""328"" ></a><br/><br />The committers listed above are authorized under a signed CLA.<ul><li>:white_check_mark: login: FANHIDE / name: hide  (dc99c66f203b6cbc2beb96b515dc9ede87ccb9c1)</li></ul>', 'This issue is currently awaiting triage.\n\nIf a SIG or subproject determines this is a relevant issue, they will accept it by applying the `triage/accepted` label and provide further guidance.\n\nThe `triage/accepted` label can be added by org members by writing `/triage accepted` in a comment.\n\n\n<details>\n\nInstructions for interacting with me using PR comments are available [here](https://git.k8s.io/community/contributors/guide/pull-requests.md).  If you have questions or suggestions related to my behavior, please file an issue against the [kubernetes-sigs/prow](https://github.com/kubernetes-sigs/prow/issues/new?title=Prow%20issue:) repository.\n</details>', ""Welcome @FANHIDE! <br><br>It looks like this is your first PR to <a href='https://github.com/kubernetes/kubernetes'>kubernetes/kubernetes</a> 🎉. Please refer to our [pull request process documentation](https://www.kubernetes.dev/docs/guide/pull-requests/) to help your PR have a smooth ride to approval. <br><br>You will be prompted by a bot to use commands during the review process. Do not be afraid to follow the prompts! It is okay to experiment. [Here is the bot commands documentation](https://go.k8s.io/bot-commands). <br><br>You can also check if kubernetes/kubernetes has [its own contribution guidelines](https://github.com/kubernetes/kubernetes/tree/master/CONTRIBUTING.md). <br><br>You may want to refer to our [testing guide](https://git.k8s.io/community/contributors/devel/sig-testing/testing.md) if you run into trouble with your tests not passing. <br><br>If you are having difficulty getting your pull request seen, please follow the [recommended escalation practices](https://www.kubernetes.dev/docs/guide/pull-requests/#why-is-my-pull-request-not-getting-reviewed). Also, for tips and tricks in the contribution process you may want to read the [Kubernetes contributor cheat sheet](https://www.kubernetes.dev/docs/contributor-cheatsheet/). We want to make sure your contribution gets all the attention it needs! <br><br>Thank you, and welcome to Kubernetes. :smiley:"", ""Hi @FANHIDE. Thanks for your PR.\n\nI'm waiting for a [kubernetes](https://github.com/orgs/kubernetes/people) member to verify that this patch is reasonable to test. If it is, they should reply with `/ok-to-test` on its own line. Until that is done, I will not automatically test new commits in this PR, but the usual testing commands by org members will still work.\n\nRegular contributors should [join the org](https://git.k8s.io/community/community-membership.md#member) to skip this step.\n\nOnce the patch is verified, the new status will be reflected by the `ok-to-test` label.\n\nI understand the commands that are listed [here](https://go.k8s.io/bot-commands?repo=kubernetes%2Fkubernetes).\n\n<details>\n\nInstructions for interacting with me using PR comments are available [here](https://git.k8s.io/community/contributors/guide/pull-requests.md).  If you have questions or suggestions related to my behavior, please file an issue against the [kubernetes-sigs/prow](https://github.com/kubernetes-sigs/prow/issues/new?title=Prow%20issue:) repository.\n</details>\n"", '[APPROVALNOTIFIER] This PR is **NOT APPROVED**\n\nThis pull-request has been approved by: *<a href=""https://github.com/kubernetes/kubernetes/pull/138050#"" title=""Author self-approved"">FANHIDE</a>*\n**Once this PR has been reviewed and has the lgtm label**, please assign [thockin](https://github.com/thockin) for approval. For more information see [the Code Review Process](https://git.k8s.io/community/contributors/guide/owners.md#the-code-review-process).\n\nThe full list of commands accepted by this bot can be found [here](https://go.k8s.io/bot-commands?repo=kubernetes%2Fkubernetes).\n\n<details open>\nNeeds approval from an approver in each of these files:\n\n- **[pkg/kubelet/cm/OWNERS](https://github.com/kubernetes/kubernetes/blob/master/pkg/kubelet/cm/OWNERS)**\n- **[pkg/kubelet/volumemanager/OWNERS](https://github.com/kubernetes/kubernetes/blob/master/pkg/kubelet/volumemanager/OWNERS)**\n\nApprovers can indicate their approval by writing `/approve` in a comment\nApprovers can cancel approval by writing `/approve cancel` in a comment\n</details>\n<!-- META={""approvers"":[""thockin""]} -->', '/check-cla\r\n', '/check-cla\r\n']",2026-03-27 15:55:20
kubernetes/kubernetes,138050,with_readme,[],"[{'sha': 'dc99c66f203b6cbc2beb96b515dc9ede87ccb9c1', 'message': '    kubelet: fix volumemanager filename typo; clarify devicemanager test comment\n\n    - Rename desired_state_of_wold_selinux_metrics.go to desired_state_of_world_selinux_metrics.go\n    - Replace misleading FIXME in runPluginManager test with an accurate comment'}]","['<a href=""https://easycla.lfx.linuxfoundation.org/#/?version=2""><img src=""https://s3.amazonaws.com/cla-project-logo-prod/cla-signed.svg?v=2"" alt=""CLA Signed"" align=""left"" height=""28"" width=""328"" ></a><br/><br />The committers listed above are authorized under a signed CLA.<ul><li>:white_check_mark: login: FANHIDE / name: hide  (dc99c66f203b6cbc2beb96b515dc9ede87ccb9c1)</li></ul>', 'This issue is currently awaiting triage.\n\nIf a SIG or subproject determines this is a relevant issue, they will accept it by applying the `triage/accepted` label and provide further guidance.\n\nThe `triage/accepted` label can be added by org members by writing `/triage accepted` in a comment.\n\n\n<details>\n\nInstructions for interacting with me using PR comments are available [here](https://git.k8s.io/community/contributors/guide/pull-requests.md).  If you have questions or suggestions related to my behavior, please file an issue against the [kubernetes-sigs/prow](https://github.com/kubernetes-sigs/prow/issues/new?title=Prow%20issue:) repository.\n</details>', ""Welcome @FANHIDE! <br><br>It looks like this is your first PR to <a href='https://github.com/kubernetes/kubernetes'>kubernetes/kubernetes</a> 🎉. Please refer to our [pull request process documentation](https://www.kubernetes.dev/docs/guide/pull-requests/) to help your PR have a smooth ride to approval. <br><br>You will be prompted by a bot to use commands during the review process. Do not be afraid to follow the prompts! It is okay to experiment. [Here is the bot commands documentation](https://go.k8s.io/bot-commands). <br><br>You can also check if kubernetes/kubernetes has [its own contribution guidelines](https://github.com/kubernetes/kubernetes/tree/master/CONTRIBUTING.md). <br><br>You may want to refer to our [testing guide](https://git.k8s.io/community/contributors/devel/sig-testing/testing.md) if you run into trouble with your tests not passing. <br><br>If you are having difficulty getting your pull request seen, please follow the [recommended escalation practices](https://www.kubernetes.dev/docs/guide/pull-requests/#why-is-my-pull-request-not-getting-reviewed). Also, for tips and tricks in the contribution process you may want to read the [Kubernetes contributor cheat sheet](https://www.kubernetes.dev/docs/contributor-cheatsheet/). We want to make sure your contribution gets all the attention it needs! <br><br>Thank you, and welcome to Kubernetes. :smiley:"", ""Hi @FANHIDE. Thanks for your PR.\n\nI'm waiting for a [kubernetes](https://github.com/orgs/kubernetes/people) member to verify that this patch is reasonable to test. If it is, they should reply with `/ok-to-test` on its own line. Until that is done, I will not automatically test new commits in this PR, but the usual testing commands by org members will still work.\n\nRegular contributors should [join the org](https://git.k8s.io/community/community-membership.md#member) to skip this step.\n\nOnce the patch is verified, the new status will be reflected by the `ok-to-test` label.\n\nI understand the commands that are listed [here](https://go.k8s.io/bot-commands?repo=kubernetes%2Fkubernetes).\n\n<details>\n\nInstructions for interacting with me using PR comments are available [here](https://git.k8s.io/community/contributors/guide/pull-requests.md).  If you have questions or suggestions related to my behavior, please file an issue against the [kubernetes-sigs/prow](https://github.com/kubernetes-sigs/prow/issues/new?title=Prow%20issue:) repository.\n</details>\n"", '[APPROVALNOTIFIER] This PR is **NOT APPROVED**\n\nThis pull-request has been approved by: *<a href=""https://github.com/kubernetes/kubernetes/pull/138050#"" title=""Author self-approved"">FANHIDE</a>*\n**Once this PR has been reviewed and has the lgtm label**, please assign [thockin](https://github.com/thockin) for approval. For more information see [the Code Review Process](https://git.k8s.io/community/contributors/guide/owners.md#the-code-review-process).\n\nThe full list of commands accepted by this bot can be found [here](https://go.k8s.io/bot-commands?repo=kubernetes%2Fkubernetes).\n\n<details open>\nNeeds approval from an approver in each of these files:\n\n- **[pkg/kubelet/cm/OWNERS](https://github.com/kubernetes/kubernetes/blob/master/pkg/kubelet/cm/OWNERS)**\n- **[pkg/kubelet/volumemanager/OWNERS](https://github.com/kubernetes/kubernetes/blob/master/pkg/kubelet/volumemanager/OWNERS)**\n\nApprovers can indicate their approval by writing `/approve` in a comment\nApprovers can cancel approval by writing `/approve cancel` in a comment\n</details>\n<!-- META={""approvers"":[""thockin""]} -->', '/check-cla\r\n', '/check-cla\r\n']",2026-03-27 15:55:22
kubernetes/kubernetes,138049,baseline,"[{'type': 'Bug', 'description': '在函数 `isPodLevelResourcesResizeInProgress` 中，当 `podStatus` 为 `nil` 时，函数会提前返回 `false`。然而，根据提交信息，此变更旨在修复“在 Pod 创建时错误地报告 PLR 调整大小正在进行”的问题。如果 `podStatus` 为 `nil`（例如，在 Pod 初始创建阶段，容器尚未启动时），函数返回 `false` 是正确的行为，因为此时没有正在进行的调整。但是，变更中新增的 `podStatus == nil` 检查与原有的 `allocatedPod.Spec.Resources == nil` 检查合并，可能导致逻辑不清晰。虽然当前实现可能正确，但将两个独立的检查条件合并可能降低代码的可读性，并且如果未来需要区分这两种情况，会变得困难。', 'evidence': '文件: pkg/kubelet/kuberuntime/kuberuntime_manager.go\n@@ -2218,11 +2218,15 @@ func (m *kubeGenericRuntimeManager) isPodLevelResourcesResizeInProgress(allocate\n \t\treturn false\n \t}\n \n-\tif allocatedPod.Spec.Resources == nil {\n+\tif allocatedPod.Spec.Resources == nil || podStatus == nil {\n+\t\treturn false\n+\t}\n+\n+\tactuatedPodResources, found := m.actuatedState.GetPodLevelResources(allocatedPod.UID)\n+\tif !found || actuatedPodResources == nil {\n \t\treturn false\n \t}\n \n-\tactuatedPodResources, _ := m.actuatedState.GetPodLevelResources(allocatedPod.UID)\n \tallocatedPodResources := allocatedPod.Spec.Resources\n \n \treturn !cpuMemoryResourcesEqual(actuatedPodResources, allocatedPodResources)', 'advice': '建议将 `allocatedPod.Spec.Resources == nil` 和 `podStatus == nil` 的检查分开，以明确各自的意图。例如，可以写成两个独立的 `if` 语句，并添加注释说明每种情况返回 `false` 的原因（例如，`podStatus == nil` 表示 Pod 尚未启动，因此没有进行中的调整）。这能提高代码的可读性和可维护性。', 'severity': 'Low'}, {'type': 'Readability', 'description': '在函数 `isPodLevelResourcesResizeInProgress` 中，对 `m.actuatedState.GetPodLevelResources` 的调用方式发生了改变。变更前使用了空白标识符 `_` 忽略第二个返回值（`found`），变更后则检查了 `found` 和 `actuatedPodResources` 是否为 `nil`。虽然新逻辑更健壮（检查资源是否存在且非空），但变更前的代码忽略了 `found` 返回值，这可能是一个潜在的错误，因为如果资源未找到，`actuatedPodResources` 可能为 `nil`，导致后续比较出现问题。新代码修复了这个问题，但提交信息中并未明确提及此修复。', 'evidence': '文件: pkg/kubelet/kuberuntime/kuberuntime_manager.go\n@@ -2218,11 +2218,15 @@ func (m *kubeGenericRuntimeManager) isPodLevelResourcesResizeInProgress(allocate\n \t\treturn false\n \t}\n \n-\tif allocatedPod.Spec.Resources == nil {\n+\tif allocatedPod.Spec.Resources == nil || podStatus == nil {\n+\t\treturn false\n+\t}\n+\n+\tactuatedPodResources, found := m.actuatedState.GetPodLevelResources(allocatedPod.UID)\n+\tif !found || actuatedPodResources == nil {\n \t\treturn false\n \t}\n \n-\tactuatedPodResources, _ := m.actuatedState.GetPodLevelResources(allocatedPod.UID)\n \tallocatedPodResources := allocatedPod.Spec.Resources\n \n \treturn !cpuMemoryResourcesEqual(actuatedPodResources, allocatedPodResources)', 'advice': '建议在提交信息或代码注释中说明此变更不仅简化了逻辑，还修复了之前忽略 `found` 返回值可能导致的潜在问题。这有助于其他开发者理解变更的完整意图。', 'severity': 'Low'}, {'type': 'Bug', 'description': '在测试文件 `kuberuntime_manager_test.go` 中，新增的测试用例 `""plr mismatch during initial creation (containers not started)""` 的 `expectHasResize` 字段设置为 `false`。这符合代码变更的逻辑：当容器未启动时（`isRunning: false`），`podStatus` 可能为 `nil` 或表示未运行，`isPodLevelResourcesResizeInProgress` 应返回 `false`。然而，测试用例中 `containers` 数组的第一个元素的 `actuated` 字段被设置为 `&testResources{cpuReq: 100}`，这与 `allocated` 的 `testResources{cpuReq: 100}` 相同。但 `podLevelResources` 的 `allocated` 是 `testResources{cpuReq: 200}`，与容器的 `allocated` 不同。这模拟了 Pod 级资源与容器级资源不匹配的情况，但根据新逻辑，由于容器未运行，函数应返回 `false`，测试期望也是 `false`。这看起来是正确的，但需要确保测试框架能正确模拟 `podStatus` 为 `nil` 或容器未运行的状态。', 'evidence': '文件: pkg/kubelet/kuberuntime/kuberuntime_manager_test.go\n@@ -5278,6 +5278,18 @@ func TestIsPodResizeInProgress(t *testing.T) {\n \t\t}},\n \t\texpectHasResize:              true,\n \t\tinplacePodLevelResizeEnabled: true,\n +\t}, {\n +\t\tname: ""plr mismatch during initial creation (containers not started)"",\n +\t\tpodLevelResources: &testPLR{\n +\t\t\tallocated: testResources{cpuReq: 200},\n +\t\t},\n +\t\tcontainers: []testContainer{{\n +\t\t\tallocated: testResources{cpuReq: 100},\n +\t\t\tactuated:  &testResources{cpuReq: 100},\n +\t\t\tisRunning: false,\n +\t\t}},\n +\t\texpectHasResize:              false,\n +\t\tinplacePodLevelResizeEnabled: true,\n \t}}', 'advice': '测试用例设计合理，覆盖了边界条件。建议确保测试函数 `TestIsPodResizeInProgress` 的内部实现能正确地将 `isRunning: false` 映射到 `podStatus` 为 `nil` 或类似状态，以准确测试代码变更。如果尚未如此，可能需要更新测试辅助函数来反映这一点。', 'severity': 'Low'}, {'type': 'Readability', 'description': '在 e2e 测试文件 `pod_level_resources_resize.go` 中，新增的测试函数 `doInitialCreationNoResizeEventTest` 包含一个注释：`// Use framework.WithKubeletMinVersion to programmatic skip older versions`。然而，实际代码中使用了 `framework.WithKubeletMinVersion(""1.36"")` 作为 `framework.It` 的选项。注释是正确的，但注释中的“programmatic”拼写错误，应为“programmatically”。虽然这是一个小问题，但保持注释的准确性有助于代码的可读性。', 'evidence': '文件: test/e2e/common/node/pod_level_resources_resize.go\n@@ -642,6 +643,40 @@ func doPodLevelResourcesMemoryLimitDecreaseTest(f *framework.Framework) {\n \t})\n }\n \n +func doInitialCreationNoResizeEventTest(f *framework.Framework) {\n +\t// Use framework.WithKubeletMinVersion to programmatic skip older versions\n +\tframework.It(""should not emit ResizeCompleted event on initial creation"", framework.WithKubeletMinVersion(""1.36""), func(ctx context.Context) {', 'advice': '建议将注释中的“programmatic”更正为“programmatically”，以保持拼写准确。例如：`// Use framework.WithKubeletMinVersion to programmatically skip older versions`。', 'severity': 'Low'}]","[{'sha': 'ba1ac16d2bcd6933f887d3a94b33004f505557c3', 'message': 'fix erroneously reporting a PLR resize in progress on pod creation'}, {'sha': 'e03ae4cc4ace96438c8ced21311c06a3df4cbe87', 'message': 'Simplify isPodLevelResourcesResizeInProgress to check for absence of actuated resources\n\nSigned-off-by: ndixita <ndixita@google.com>'}]","['Skipping CI for Draft Pull Request.\nIf you want CI signal for your change, please convert it to an actual PR.\nYou can still manually trigger a test run with `/test all`', 'Adding the ""do-not-merge/release-note-label-needed"" label because no release-note block was detected, please follow our [release note process](https://git.k8s.io/community/contributors/guide/release-notes.md) to remove it.\n\n<details>\n\nInstructions for interacting with me using PR comments are available [here](https://git.k8s.io/community/contributors/guide/pull-requests.md).  If you have questions or suggestions related to my behavior, please file an issue against the [kubernetes-sigs/prow](https://github.com/kubernetes-sigs/prow/issues/new?title=Prow%20issue:) repository.\n</details>', 'This issue is currently awaiting triage.\n\nIf a SIG or subproject determines this is a relevant issue, they will accept it by applying the `triage/accepted` label and provide further guidance.\n\nThe `triage/accepted` label can be added by org members by writing `/triage accepted` in a comment.\n\n\n<details>\n\nInstructions for interacting with me using PR comments are available [here](https://git.k8s.io/community/contributors/guide/pull-requests.md).  If you have questions or suggestions related to my behavior, please file an issue against the [kubernetes-sigs/prow](https://github.com/kubernetes-sigs/prow/issues/new?title=Prow%20issue:) repository.\n</details>', '[APPROVALNOTIFIER] This PR is **NOT APPROVED**\n\nThis pull-request has been approved by: *<a href=""https://github.com/kubernetes/kubernetes/pull/138049#"" title=""Author self-approved"">ndixita</a>*\n**Once this PR has been reviewed and has the lgtm label**, please assign [sergeykanzhelev](https://github.com/sergeykanzhelev) for approval. For more information see [the Code Review Process](https://git.k8s.io/community/contributors/guide/owners.md#the-code-review-process).\n\nThe full list of commands accepted by this bot can be found [here](https://go.k8s.io/bot-commands?repo=kubernetes%2Fkubernetes).\n\n<details open>\nNeeds approval from an approver in each of these files:\n\n- **[pkg/kubelet/OWNERS](https://github.com/kubernetes/kubernetes/blob/master/pkg/kubelet/OWNERS)**\n- **[test/e2e/common/OWNERS](https://github.com/kubernetes/kubernetes/blob/master/test/e2e/common/OWNERS)**\n\nApprovers can indicate their approval by writing `/approve` in a comment\nApprovers can cancel approval by writing `/approve cancel` in a comment\n</details>\n<!-- META={""approvers"":[""sergeykanzhelev""]} -->', '/test pull-kubernetes-node-kubelet-inplace-pod-level-resources-resize']",2026-03-27 15:57:18
